<?xml version="1.0" encoding="UTF-8"?>
<releve xmlns:xsi="http://www.w3.org/2001/XMLSchema-instance"
    xsi:noNamespaceSchemaLocation="file:/C:/Users/NANOTEK/TP/Web-Service/Devoir/XML/releve.xsd" RIB="2325638">
    <dateReleve>2021-11-10</dateReleve>
    <solde>14000</solde>
    <operations dateDebut="2021-01-01" dateFin="2021-01-30">
        <operation type="CREDIT" date="2021-01-01" montant="9000" decription="Cheque Guichet"/>
        <operation type="CREDIT" date="2021-01-01" montant="9000" decription="Cheque Guichet"/>
        <operation type="DEBIT" date="2021-01-15" montant="120" decription="Prelevement Assurence"/>
        <operation type="CREDIT" date="2021-01-25" montant="70000" decription="Virement ..."/>
    </operations>
</releve>